video_id,published_time,trending_date,channel_id,channel_title,video_title,category_id,thumbnail_link,view_count,like_count,dislike_count,favorite_count,comment_count,rating_disable,comment_disable,tags,description
"-UCDXvmgias","2020-09-13T21:32:49Z","20.14.09","UC4i_9WvfPRTuRWEaWyfKuFw","BT Sport","Carnage in Le Classique! Neymar amongst FIVE players sent off!","17","https://i.ytimg.com/vi/-UCDXvmgias/default.jpg","4310823","64705","2182","0","6556","False","False","neymar|Le Classique|psg|paris saint germain|marseille|ligue 1|scuffle|red cards|bt sport|bt sport official","PSG VS Marseille finishes 8v9 after the referee gives FIVE red cards, including one for Neymar, in the final few minutes! 

Neymar tells the fourth official there was a racist incident after receiving his marching orders...

Hit 'Subscribe' above to ensure you never miss a video from the BT Sport YouTube channel.

Visit and subscribe to our 'BT Sport Boxing' YouTube channel ➡️ http://www.youtube.com/c/btsportboxing

Twitter: http://twitter.com/btsport
Facebook: http://www.facebook.com/btsport
Instagram:http://instagram.com/btsport
Website: http://sport.bt.com"
"3CxtK7-XtE0","2020-09-04T04:15:41Z","20.14.09","UCrFB54bqp8sda4udJyNswlA","DJKhaledVEVO","DJ Khaled ft. Drake - POPSTAR (Official Music Video - Starring Justin Bieber)","10","https://i.ytimg.com/vi/3CxtK7-XtE0/default.jpg","45726766","2152963","99719","0","118356","False","False","Father Of Ashad|Ashad|I'm the One|No Brainer|grateful|major key|drake|new khaled|khaled and drake|popstar|greece|we the best|epic|epic records|new music|DJ Khaled|Epic/We The Best|Hip Hop|POPSTAR"," POPSTAR  ft. Drake available at: https://DJKhaled.lnk.to/POPSTAR
Official Audio: https://youtu.be/-iNWEwLfkv8

Production Company: Fela / Mssng Peces 
Director: Julien Christian Lutz pka Director X
Producer: Fuliane Petikyan / Taj Critchlow / Sam Lecca 
DP: Chris Probst

Follow DJ Khaled:
https://www.instagram.com/djkhaled/
https://twitter.com/djkhaled
https://www.facebook.com/officialdjkhaled/

Lyrics:
Bitches

We the Best Music
Another One (yeah)
DJ Khaled

Bitches calling my phone like I’m locked up nonstop
From the plane to the fucking helicopter yeah
Cops pulling up like I’m giving drugs out nah nah
I’m a popstar not a doctor
Bitches calling my phone like I’m locked up nonstop
From the plane to the fucking helicopter yeah
Cops pulling up like I’m giving drugs out nah nah
I’m a popstar not a doctor

Aye, shorty with the long text I don’t talk, aye
Shorty with the long legs she don’t walk, yeah
Last year I kept it on the tuck, aye
2020, I came to fuck it up, yeah
I want a long life a legendary one
I want a quick death yeah and an easy one
I want a pretty girl and an honest one
I want this drink and another one, yeah
And I’m troublesome, yeah
I’m a popstar but this shit ain’t bubblegum, yeah
You would probably think my manager was Scooter Braun, yeah
But my manager with 20 hoes in Buddakan, yeah
Aye, look, Arianna, Selena my Visa
It can take as many charges as it needs to my girl
That shit platinum just like all of my releases my girl
Niggas come for me I tear them all to pieces my girl
I’m gonna show your sexy ass what relief is my girl
Please don’t take no shit that’s bout to have you geekin
And I’m not driving nothing that I got to stick the keys in 
Wonder how I got this way I swear I got the 

Bitches calling my phone like I’m locked up nonstop
From the plane to the fucking helicopter yeah
Cops pulling up like I’m giving drugs out nah nah
I’m a popstar not a doctor
Bitches calling my phone like I’m locked up nonstop
From the plane to the fucking helicopter yeah
Cops pulling up like I’m giving drugs out nah nah
I’m a popstar not a doctor

I’m a popstar not a doctor
Watch her said she rep a whole different block so I blocked her
Busy at the crib cooking salmon with the lobster
If we talking joints it’s just me and David Foster
Bodyguards don’t look like Kevin Costner you tweakin
Just pulled up to Whitney Houston Texas for the evening
They tell the same story so much they start to believe it 
The ones that start like Drizzy shit was cool but we even
Man how the fuck….
2,4,6,8 watch is factory so they appreciate 
Crown in my hand and I’m really playing keep away
Shit don’t even usually get this big without a Bieber face
Nah nah piece of cake
Nah nah Turks and Caic
Yeah yeah go and get your friends we can sneak away
Yeah yeah yeah I keep a … like I keep the faith
Wonder how I got this way swear I got the 

Bitches calling my phone like I’m locked up nonstop
From the plane to the fucking helicopter yeah
Cops pulling up like I’m giving drugs out nah nah
I’m a popstar not a doctor
Bitches calling my phone like I’m locked up nonstop
From the plane to the fucking helicopter yeah
Cops pulling up like I’m giving drugs out nah nah
I’m a popstar not a doctor

(C) 2020 OVO as licensed to We The Best/Epic Records"
"ku4AGC0AGOg","2020-09-11T08:53:08Z","20.14.09","UC4QjJrHPKO55921IMfbxSEw","Spårtsklubben VGTV","Sannheten bak krangelen som nesten stoppet Spårtsklubben","22","https://i.ytimg.com/vi/ku4AGC0AGOg/default.jpg","74744","2134","33","0","107","False","False","Mads Hansen|Morten Ramm|Jon Martin Henriksen|Erik Follestad|Ida Fladen|Humornieu|Nieu|Slag|Slossing|Krangel|Dokumentar|Spårtsklubben","SLAGENE PÅ NIEU. Dette er Spårtsklubbens første (og eneste?) dokumentar. Den handler om situasjonen som var i ferd med å stoppe hele programmet - og historien bak Mads Hansen sine pranks på Erik Follestad."
"n9xhJrPXop4","2020-09-09T16:18:02Z","20.14.09","UCjmJDM5pRKbUlVIzDYYWb6g","Warner Bros. Pictures","Dune Official Trailer","24","https://i.ytimg.com/vi/n9xhJrPXop4/default.jpg","20647670","459644","14270","0","52729","False","False","","Beyond fear, destiny awaits. Watch the trailer for the highly anticipated #DuneMovie now. 


-----------------
https://www.facebook.com/dune
 https://twitter.com/dunemovie
https://www.instagram.com/dunemovie
-----------------

Oscar  nominee  Denis  Villeneuve  (“Arrival,”  “Blade  Runner  2049”)  directs  Warner  Bros.  Pictures  and  Legendary Pictures’ “Dune,” the big-screen adaptation of Frank Herbert’s seminal bestseller of the same name. A mythic and emotionally charged hero’s journey, “Dune” tells the story of Paul Atreides, a brilliant and gifted young man born into a great destiny beyond his understanding, who must travel to the most dangerous planet  in  the  universe  to  ensure  the  future  of  his  family  and  his  people.  As  malevolent  forces  explode  into conflict over the planet’s exclusive supply of the most precious resource in existence—a commodity capable of unlocking humanity’s greatest potential—only those who can conquer their fear will survive.The film stars Oscar nominee Timothée Chalamet (“Call Me by Your Name,”  “Little Women”), Rebecca Ferguson  (“Stephen  King’s  Doctor  Sleep,”   “Mission:  Impossible  –  Fallout”),  Oscar  Isaac  (the “Star  Wars” franchise) Oscar nominee Josh Brolin (“Milk,” “Avengers: Infinity War”), Stellan Skarsgård (HBO’s “Chernobyl,” “Avengers: Age of Ultron”), Dave Bautista (the “Guardians of the Galaxy” films, “Avengers: Endgame”), Stephen McKinley Henderson (“Fences,” “Lady Bird”), Zendaya (“Spider-Man: Homecoming,” HBO’s “Euphoria”), Chang Chen (“Mr.  Long,” “Crouching  Tiger,  Hidden  Dragon”),    David  Dastmalchian  (“Blade  Runner  2049,”  “The  Dark  Knight”), Sharon  Duncan-Brewster  (“Rogue  One:  A  Star  Wars  Story,”  Netflix’s “Sex  Education”),   with  Oscar  nominee Charlotte Rampling (“45 Years,” “Assassin’s Creed”), with Jason Momoa (“Aquaman,” HBO’s “Game of Thrones”), and Oscar winner Javier Bardem (“No Country for Old Men,” “Skyfall”).   Villeneuve directed “Dune” from a screenplay he co-wrote with Jon Spaihts and Eric Roth based on the novel of the same name written by Frank Herbert.  Villeneuve also produced the film with Mary Parent, Cale Boyter  and  Joe  Caracciolo,  Jr.   The  executive  producers  are  Tanya  Lapointe,  Joshua  Grode,  Herbert  W.  Gains, Jon Spaihts, Thomas Tull, Brian Herbert, Byron Merritt and Kim Herbert. Behind  the  scenes,  Villeneuve  reteamed  with  two-time  Oscar-nominated  production  designer  Patrice  Vermette  (“Arrival,”  “Sicario,”  “The  Young  Victoria”),  two-time  Oscar-nominated  editor  Joe  Walker  (“Blade  Runner  2049,”  “Arrival,”  “12  Years  a  Slave”),  two-time  Oscar-winning  visual  effects  supervisor  Paul  Lambert  (“First Man,” “Blade Runner 2049”), and Oscar-winning special effects supervisor Gerd Nefzer (“Blade Runner 2049”).    He  also  collaborated  for  the  first  time  with  Oscar-nominated  director  of  photography  Greig  Fraser  (“Lion,”  “Zero  Dark  Thirty,”  “Rogue  One:  A  Star  Wars  Story”);  three-time  Oscar-nominated  costume  designer  
Jacqueline West (“The Revenant,” “The Curious Case of Benjamin Button,” “Quills”) and co-costume designer Bob Morgan; and stunt coordinator Tom Struthers (“The Dark Knight” trilogy, “Inception”).  Oscar-winning and multiple  Oscar-nominated  composer  Hans  Zimmer  (“Blade  Runner  2049,”  “Inception,”  “Gladiator,”  “The  Lion King”) is creating the score.  Warner  Bros.  Pictures  and  Legendary  Pictures  Present  “Dune.”    The  film  is  slated  to  be  released  in  theaters on December 18, 2020."
"53vz5pQH0Rg","2020-09-10T17:00:10Z","20.14.09","UCcgVECVN4OKV6DH1jLkqmcA","Jake Paul","Jake Paul - 23 (Official Music Video) Starring Logan Paul","22","https://i.ytimg.com/vi/53vz5pQH0Rg/default.jpg","10504428","246123","181189","0","43714","False","False","jake paul|mini jake paul|jake paul pranks|logan paul|jake paul scary vids|team 10|lucas and marcus|jake paul song|Jake Paul youtube|Hype House|team 10 vs hype house|trending|trending tiktok songs|Tik Tok|tik tok mashup|tik tok video|Jake Paul - Fresh Outta London (Official Music Video)|Jake Paul - 23 (Official Music Video) starring Logan Paul|Jake Paul - Every Day Bro|Logan Paul Vlogs|Jake Paul Vlogs|Impaulsive Podcast|NLE Choppa|Lil Tjay","Save  23  to your music library 👉🏼 https://lnk.to/JP23
Save  23  to your music library 👉🏼 https://lnk.to/JP23
Save  23  to your music library 👉🏼 https://lnk.to/JP23

🔴SUBSCRIBE ➤ http://bit.ly/SUB2JAKEPAUL 

INSTAGRAM ➤  https://www.instagram.com/JakePaul 
TWITTER ➤  http://twitter.com/JakePaul

Credits: 
Directed by: Jake Paul
DP/Edit: Logan Meis
Steadi: Aser Santos Jr.
1st AC: Chris Pinto
2nd AC: Donald Turner
G&E: Special Purpose Lighting & Grip
Producers: Nolan Riddle & Marcos Guerrero
DP: Logan Meis

Lyrics:
Had to do maybach 
I can’t do a regular Benz 
I like the seats that recline 
Know I’m dog 
Yes I’m fuckin her and her friend 
I like em two at a time 
And She wanna slide she pull out her insta and shit
She go if she fuck up the vibe 
How am I 23 sittin on 23 I feel like Jordan 
I’m back in my prime (2x)

This years in the makin shit why would I lie 
Dreamed of the whip now I don’t even drive 
I got a chauffeur 
She told me I’m drivin her crazy 
She hate what I’m doin online 
10 in a week and I’m just not suprised
I had to take that one home to the guys 
I got the feds watchin 
Haters watchin 
News watchin that’s a whole lotta eyes 
I went and Flooded my wrist 
For the fuck of this shit 

While these rappers just run out of time 
I’m here forever 
This lives televised 
Ain’t no way they could take none from any of mine 
That boy a vette 
And he still on the rise 
Rolls or the Bentley shit I can’t decide 
I got the paparazzi at the front of my door 
I can’t leave shit I need a disguise

Had to do maybach 
I can’t do a regular Benz 
I like the seats that recline 
Know I’m dog 
Yes I’m fuckin her and her friend 
I like em two at a time 
And She wanna slide she pull out her insta and shit
She go if she fuck up the vibe 
How am I 23 sittin on 23 I feel like Jordan 
I’m back in my prime (2x)"
"cT-_8D-CnbI","2020-09-07T13:00:16Z","20.14.09","UC95ycoC9Rdyt-TkzP48WblQ","NRK FlippKlipp","24 TIMER UTEN VANN","24","https://i.ytimg.com/vi/cT-_8D-CnbI/default.jpg","131383","5111","251","0","0","False","False","flippklipp|nrk|nrksuper|nrk super|victor sotberg|christopher robin omdahl","Hvor lenge klarer Chris å gå uten vann? Er det i det hele tatt mulig å gå en hel dag uten å bruke eller drikke vann?!

Anbefalt aldersgrense: Alle
Les mer: https://www.medietilsynet.no/barn-og-medier/aldersgrenser/

Nettside: www.nrksuper.no
Mail: flippklipp@nrk.no"
"cWUfgj9QkZY","2020-08-24T10:11:49Z","20.14.09","UCDVn8wLFP-zeFVWfWIFb14A","NRK Super","BlimE - Ser deg - Victor Sotberg - BlimE-dansen 2020 - NRK Super","1","https://i.ytimg.com/vi/cWUfgj9QkZY/default.jpg","1038770","6349","1626","0","0","False","False","nrksuper|nrk|super|barn|norge|underholdning|musikkvideo","VERS 1
Ser du står alein
Har alle glemt 
at det er 
plass til flere

Vi skal samme vei
Når vi er sammen
Er vi
Bedre

Om du har lyst har du lov, du kan bli med
Trenger æ å si mer?
Kom heng dæ på

PRECHORUS
Æ hakke sett dæ her før
Men æ lover at æ ser dæ no

Kan du lær mæ å forstå
Æ vil danse litt i dine sko

CHORUS
Æ ser dæ som du e
Æ la la la la liker når du danser med mæ

Æ ser dæ som du e
Æ la la la la liker når vi danser, danser

VERS 2
Verden åpna sæ
Da du kom inn
Og åpna
Øyan mine

Tenk å ha en venn som dæ
Du gir mæ smil 
Når alt e
Svart her

Om du har lyst har du lov, du kan bli med
Trenger æ å si mer?
Kom heng dæ på

PRECHORUS
Æ hakke sett dæ her før
Men æ lover at æ ser dæ no
Kan du lær mæ å forstå
Æ vil danse litt i dine sko

CHORUS
Æ ser dæ som du e
Æ la la la la liker når vi danser med mæ

Æ ser dæ som du e
Æ la la la la liker når vi danser

BRIDGE:
Det e’kke fullt så mørkt nå
Når vi står her sammen
Lyser vi opp himmelen
Det e’kke fullt så mørkt nå
Når vi står her sammen
Lyser vi opp himmelen

PRECHORUS
Æ hakke sett dæ her før
Men æ lover at æ ser dæ no
Kan du lær mæ å forstå
Æ vil danse litt i dine sko

CHORUS
Æ ser dæ som du e
Æ la la la la liker når du danser med mæ

Æ ser dæ som du e
Æ la la la la liker når vi danser

Æ ser dæ som du e 
Æ la la la la liker når du danser med mæ
Æ ser dæ som du e
Æ la la la la liker når vi danser, danser

Anbefalt alder: Tillatt for alle (A)
Les mer om aldersmerking hos Medietilsynet: https://medietilsynet.no/barn-og-medier/aldersgrenser/

Nettside: nrksuper.no
E-post: info@nrk.no
NRK Super 2020"
"8WBfyjt7rP8","2020-09-12T21:00:00Z","20.14.09","UC9LQwHZoucFT94I2h6JOcjw","Liverpool FC","Highlights: Liverpool 4-3 Leeds Utd | Salah hits a hat-trick on the opening day","17","https://i.ytimg.com/vi/8WBfyjt7rP8/default.jpg","2539669","45597","2107","0","3380","False","False","Liverpool FC|LFC|Liverpool|Anfield|Melwood|Liverpool Football Club|premier league","Watch key highlights from Liverpool's opening day victory over Leeds United, as a Virgil van Dijk header, and three goals from Mo Salah gave Jürgen Klopp's side all three points as they kicked off the defence of their Premier League crown.

Enjoy more content and get exclusive perks in our Liverpool FC Members Area, click here to find out more: https://www.youtube.com/LiverpoolFC/join

Subscribe now to Liverpool FC on YouTube now and get notified when new videos land: https://www.youtube.com/subscription_center?add_user=LiverpoolFC"
"w_Zm1LuTyes","2020-09-08T07:40:14Z","20.14.09","UCRH1LYGNyUHMxJKN3ZITBeg","Harm & Hegseth // VGTV","PANELET #181: Supervikarer, mensentruser og alpakkavandring","24","https://i.ytimg.com/vi/w_Zm1LuTyes/default.jpg","58743","1290","18","0","109","False","False","Panelet|VGTV Rampelys|morten hegseth|vegard harm|kjendis|rampelys|ida fladen|erik follestad|71 grader nord|viral|tiktok","Morten og Vegard er på ferie! Derfor er det Ida Fladen og Erik Follestad som denne gangen diskuterer ukas snakkiser innen kjendis- og underholdningsverdenen.

Tillatt for alle aldersgrupper.

Se mer fra Panelet: www.vgtv.no/kategori/100065/panelet"
"jV1v2Cy1w30","2020-09-04T04:00:00Z","20.14.09","UCF6jRAgCbSanHolKt0Vt6Qw","Tekashi 6ix9ine","6IX9INE - TUTU (Official Music Video)","10","https://i.ytimg.com/vi/jV1v2Cy1w30/default.jpg","61812825","1796995","220700","0","146874","False","False","6ix9ine|6ix9ine tutu official music video|6ix9ine tutu|tutu 6ix9ine|tutu|tutu music video|tekashi 69|tekashi 6ix9ine|69|tattletales 6ix9ine|tattle tales 6ix9ine|6ix9ine tattletales|6ix9ine tattle tales|tattletales|tattle tales|6ix9ine music|6ix9ine new music|6ix9ine new album|new album 6ix9ine|6ix9ine new song|tekashi69|6ix9ine album|tekashi|6ix9ine tattletales album|69 tekashi69|69 new song|six nine|six6nine9|sixnine|69x9ine","Album TattleTales OUT NOW!
https://cmg.ffm.to/TattleTales

Directed by: Just4canon & 6ix9ine 
Ep/Producer: David Wept & Omar Reynoso 
DP: Parris Stewart 
G&E: RecSquad TV 
Colorist: Bryan Smaller 
Editor: Just4canon
Production Co: AT.LAS x Fatking Films
Mastered & Engineered by: Wizard Lee
Cover art by: Alex Solis
Casting by: DV Casting
LYRICS:

I get money when I want to
I get b*tches when I want to
Tote this pistol when I want to
Money dance step hit the 1,2

You cant bop like this
Everybody want my swag
Everybody want my drip
Had to tell them back back
Tell them to get off my d*ck
Watch me do the money dance
Watch me hit my skip
Bet you cant do it like this
No you cant do it like this

I get money when I want to
I get b*tches when I want to
Tote this pistol when I want to
Money dance step hit the 1,2

Oh you paid well b*tch im paid too
Dont talk to me i talk to you
If this f*ck me then its f*ck you
Yeah its middle finger f*ck you

Everybody know i got bands on the way
Yes I make Yes I make bands everyday
Everybody been knew that im getting paid
That im getting that im getting that im gettin paid

Cuz
You cant bop like this
Everybody want my swag
Everybody want my drip
Had to tell them back back
Tell them to get off my d*ck
Watch me do the money dance
Watch me hit my skip
Bet you cant do it like this
No you cant do it like this

I get money when I want to
I get b*tches when I want to
Tote this pistol when I want to
Money dance step hit the 1,2

Oh you paid well b*tch im paid too
Dont talk to me i talk to you
If this f*ck me then its f*ck you
Yeah its middle finger f*ck you

Money coming in
Money going out
Rappers coming in
Rappers going out
Funny how they tryna take my style
Funny how they tryna break me down
Yall n*ggas better watch yall mouth
Yall starting to sound like clowns
All these rappers wanna talk that clout
I dont know whats that about

They wanna rap like this
They wanna talk like this
They wanna walk like this
They wanna look like this
They wanna be like this
They wanna bop like this
They wanna chart like this
N*ggas s*ck my d*ck
You Can’t do this cuz you aint me
It drives you n*ggas crazy
It keeps you up at night
Cuz

You cant bop like this
Everybody want my swag
Everybody want my drip
Had to tell them back back
Tell them to get off my d*ck
Watch me do the money dance
Watch me hit my skip
Bet you cant do it like this
No you cant do it like this

I get money when I want to
I get b*tches when I want to
Tote this pistol when I want to
Money dance hit the 1,2

Oh you paid well b*tch im paid too
Don't talk to me I talk to you
If this f*ck me then its f*ck you
Yeah its middle finger f*ck you"
"EQ1_ZVDrSW8","2020-09-11T11:59:26Z","20.14.09","UC7Z1Kx1pU8ID5GMoZzsibfQ","NRK Humor"," Nå er det helg  Musikkvideo fra Norske Grønnsakers nye tv-serie!","23","https://i.ytimg.com/vi/EQ1_ZVDrSW8/default.jpg","20068","966","12","0","65","False","False","Norske Grønnsaker|Distriktspolitiet|Nå er det|helg|musikkvideo|sang|låt|no e det|vassendgutane|dvassendgutane","Se alle episodene av tv-serien Distriktspolitiet på nrk-tv:  https://tv.nrk.no/serie/distriktspolitiet"
"uZnJNgx3gUU","2020-09-12T18:05:03Z","20.14.09","UCo_IB5145EVNcf8hw1Kku7w","The Game Theorists","Game Theory: FNAF, We Solved Golden Freddy! (Five Nights At Freddy's)","20","https://i.ytimg.com/vi/uZnJNgx3gUU/default.jpg","3849839","229301","4093","0","29234","False","False","FNAF|five nights at freddy's|fnaf theory|the foxy|foxy bro|fazbear frights|fnaf books|golden freddy|fnaf golden freddy|five nights at freddy's theory|five nights at freddys|fnaf ar|fnaf vr|fnaf vr help wanted|fnaf vr ending|fnaf vr dlc|fnaf help wanted|fnaf special delivery|new fnaf teaser|fnaf sister location|sister location|fnaf world|scott cawthon|new fnaf|fnaf trailer|new fnaf trailer|game theory|game theorists|matpat|game theory FNAF|matpat fnaf|fnaf","Special thanks to Audible for sponsoring this episode!  
Get get a 30-day trial of Audible today! ► https://audible.com/matpat
or text MATPAT to 500-500  

Yes, it's time to talk about FNAF lore... again! Theorists, today we are solving one of the BIGGEST mysteries in the Five Nights At Freddy's universe - Golden Freddy. I know I've talked at length about our favorite golden animatronic bear, but here me out. The newest Fazbear Frights book CONFIRMED it! It's time to uncover the SOULS stuck inside Golden Freddy!

Don't forget to Subscribe to Food Theory! ► https://bit.ly/2CdCooV  

Need Royalty Free Music for your Content? Try Epidemic Sound. 
Get A 30 Day Free Trial! ► http://share.epidemicsound.com/MatPat

Get yourself some Theory Wear!! ► http://creatorink.co/theorywear1  
SUBSCRIBE for Every Theory! ►► http://bit.ly/1qV8fd6   
Hang out with us on GTLive! ► http://bit.ly/1LkSBnz 

#FNAF #FiveNightsAtFreddys #GoldenFreddy #FNAFVR #SisterLocation #FNAFBooks #FNAFTheory   #MatPat #Theory #GameTheory   

More THEORIES: 
FNAF, The FINAL Timeline ►► https://bit.ly/2MlHYFe
FNAF, The Monster We MISSED! ►► https://youtu.be/_ygN8HLCaJg
FNAF This Theory Changes Everything ► https://bit.ly/2JUQUn6
FNAF, You Were Meant To Lose ► https://youtu.be/7bn8hM9k0b0
FNAF 6, No More Secrets ► https://bit.ly/2LVCq4u   

Credits:
Writers: Matthew Patrick
Editors: Pedro Freitas, Alex  Sedge  Sedgwick, and Dan  Cybert  Seibert
Assistant Editor: AlyssaBeCrazy
Sound Editor: Yosi Berman"
"GUJqRkBEEY4","2020-09-06T16:59:59Z","20.14.09","UCzTKskwIc_-a0cGvCXA848Q","NikkieTutorials","Get Glam With SELENA GOMEZ & Me! | NikkieTutorials","26","https://i.ytimg.com/vi/GUJqRkBEEY4/default.jpg","7628628","472756","5563","0","21151","False","False","selena gomez|selena gomez makeup|selena|gomez|selena gomez rare|rare|rare beauty|selena gomez makeup routine|vogue|blackpink|ice cream|selena gomez makeup tutorial|get ready with me|get ready with me selena gomez|nikkietutorials|nikkie tutorials|nikkitutorials|nikki tutorials|nikkietutorials selena|nikkietutorials selena gomez|drama|review|rare beauty review|honest|selenator|boyfriend|ex|justin bieber|james charles|jeffree star|music video","I cannot believe I’m saying this, but… In today’s video, I’m trying Rare Beauty for the first time with the queen herself SELENA GOMEZ! Selena just launched her own makeup brand, and today we’re getting glam together! We discuss her new song with BLACKPINK, her private life and she even tries out MY EYESHADOW PALETTE in collaboration with Beauty Bay! Enjoy and don't forget to thumbs up and subscribe!

JOIN THE WAITLIST FOR MY PALETTE HERE 🦋 https://bit.ly/2YB6IBG

SHOP Rare Beauty here 💋 https://www.rarebeauty.com/

🔥 PREVIOUS VIDEO • MY OWN PALETTE! NikkieTutorials x BEAUTY BAY REVEAL! → https://youtu.be/MZI1BxXbhss 🔥

Make sure you subscribe to my channel and hit the notification bell, so you don’t miss any of my new videos → http://bit.ly/SubscribeNikkieTutorials

••••••••••••••••••••••••••••••••••••••••­­­•••••••••••

▷ LET’S BECOME FRIENDS!!
TWITTER ‣ http://www.twitter.com/Nikkietutorials
INSTAGRAM ‣ https://instagram.com/nikkietutorials/
TIKTOK ‣ https://vm.tiktok.com/nf6f2K/
SNAPCHAT ‣ https://www.snapchat.com/add/nikkietutorials

▷ OTHER VIDEOS YOU CAN CHECK OUT…….

👑 THE POWER OF MAKEUP ► http://bit.ly/2scYIrE

💻 Doing LADY GAGA'S Makeup! ► http://bit.ly/2M0moIy

🎀 Doing My FIANCE'S Makeup! ► https://bit.ly/3bsgHxu

🍑 POWER OF MAKEUP: KIM KARDASHIAN WEST ► http://bit.ly/2iz1RhT

••••••••••••••••••••••••••••••••••••••••­­­•••••••••••

Disclaimer ‣ This video is NOT sponsored. All thoughts mentioned are my own. No affiliate links are used. Honesty is key on my channel, thank you for supporting me!

Visuals & sound by Studio Beng Beng: https://www.instagram.com/studiobengbeng/

ʕ•ᴥ•ʔ I love you."
"Ann3hwgLjeM","2020-09-03T11:34:13Z","20.14.09","UCRH1LYGNyUHMxJKN3ZITBeg","Harm & Hegseth // VGTV","PANELET #179: Viral bading, Paradise-kunnskapstest og Zara Larsson","24","https://i.ytimg.com/vi/Ann3hwgLjeM/default.jpg","56183","888","32","0","88","False","False","Panelet|VGTV Rampelys|morten hegseth|vegard harm|kjendis|rampelys|bloggerne|emma ellingsen|zara larsson|tiktok","Morten Hegseth og Vegard Harm diskuterer ukas snakkiser innen kjendis- og underholdningsverdenen.

Tillatt for alle aldersgrupper.

Se mer fra Panelet: vgtv.no/kategori/5/rampelys"
