video_id,published_time,trending_date,channel_id,channel_title,video_title,category_id,thumbnail_link,view_count,like_count,dislike_count,favorite_count,comment_count,rating_disable,comment_disable,tags,description
"Tt94jkztAlY","2020-09-11T03:34:43Z","20.14.09","UCDVYQ4Zhbm3S2dlz7P1GBDg","NFL","Texans vs. Chiefs Week 1 Highlights | NFL 2020","17","https://i.ytimg.com/vi/Tt94jkztAlY/default.jpg","4433857","52727","5849","0","10453","False","False","NFL|Football|offense|defense|American Football|highlight|highlights|game|sport|play|plays|season|2020|touchdown|td|game highlights|week 1|best plays|top plays|texans|houston|hou|chiefs|kansas city|kc|texans chiefs game highlights|texans highlights|chiefs highlights|texans td|chiefs td|David Johnson TD|Patrick Mahomes TD","The Houston Texans take on the Kansas City Chiefs during Week 1 of the 2020 NFL season.

Subscribe to NFL: http://j.mp/1L0bVBu

Check out our other channels:
Para más contenido de la NFL en Español, suscríbete a https://www.youtube.com/nflenespanol
NFL Fantasy Football https://www.youtube.com/nflfantasyfootball
NFL Vault http://www.youtube.com/nflvault
NFL Network http://www.youtube.com/nflnetwork
NFL Films http://www.youtube.com/nflfilms
NFL Rush http://www.youtube.com/nflrush
NFL Play Football https://www.youtube.com/playfootball
NFL Podcasts https://www.youtube.com/nflpodcasts

#NFL #Texans #Chiefs"
"vRXZj0DzXIA","2020-08-28T04:00:11Z","20.14.09","UCOmHUn--16B90oW2L6FRR3A","BLACKPINK","BLACKPINK - 'Ice Cream (with Selena Gomez)' M/V","10","https://i.ytimg.com/vi/vRXZj0DzXIA/default.jpg","239345519","12633338","952471","0","2812503","False","False","YG Entertainment|YG|와이지|K-pop|BLACKPINK|블랙핑크|블핑|제니|로제|리사|지수|Lisa|Jisoo|Jennie|Rosé|BLINK|블링크|Ice Cream|BLACKPINK Ice Cream|블랙핑크 Ice Cream|Selena Gomez Ice Cream|셀레나 고메즈 Ice Cream|셀레나 고메즈|Selena Gomez|Selpink|셀핑크","BLACKPINK - ‘Ice Cream (with Selena Gomez)’

Come a little closer cause you looking thirsty 
Imma make it better sip it like a Slurpee

Snow cone chilly 
Get it free like Willy 
In the jeans like Billie 
You be poppin’ like a wheelie 

Even in the sun you know I keep it icy 
You could take a lick but it’s too cold to bite me 

Brrr brrr frozen 
You’re the one been chosen 
Play the part like Moses 
Keep it fresh like roses 

Look so good yeah look so sweet 
Looking good enough to eat 

Coldest with this kiss so he call me ice cream 
Catch me in the fridge right where the ice be 

Look so good yeah look so sweet 
Baby you deserve a treat 

Diamonds on my wrist so he call me ice cream 
You can double dip cause I know you like me 

Ice cream chillin’ chillin’ 
Ice cream chillin’
Ice cream chillin’ chillin’ 
Ice cream chillin’

I know that my heart could be so cold 
But I’m sweet for you come put me in a cone

You’re the only touch yeah they get me melting
He’s my favorite flavor always gonna pick him

You’re the cherry piece just stay on top of me so
I can’t see nobody else for me no

Get it flip it scoop it 
Do it like that ah yeah ah yeah
Like it love it lick it
Do it like lalala oh yeah

Look so good yeah look so sweet 
Looking good enough to eat 

Coldest with this kiss so he call me ice cream 
Catch me in the fridge right where the ice be 

Look so good yeah look so sweet 
Baby you deserve a treat 

Diamonds on my wrist so he call me ice cream 
You can double dip cause I know you like me

Ice cream chillin’ chillin’ 
Ice cream chillin’
Ice cream chillin’ chillin’ 
Ice cream chillin’
Ice cream chillin’ chillin’ 
Ice cream chillin’
Ice cream chillin’ chillin’ 
Ice cream 

Chillin’ like a villain yeah ra ra ra
미친 미친듯한 속도 in my La Fera
너무 빨러 너는 삐끗 원한다면 그냥 지름
Millis Billis 매일 벌음 한여름 손목에 얼음

Keep it movin’ like my lease up
Think you fly boy where ya visa
Mona Lisa kinda Lisa
Needs an ice cream man that treats her

Keep it movin’ like my lease up
Think you fly boy where ya visa
Mona Lisa kinda Lisa
Needs an ice cream man that treats her

Na na na na na 
na na na na na na na
Ice on my wrist yeah I like it like this
Get the bag with the cream
If you know what I mean

Ice cream 
Ice cream 
Ice cream chillin’

Na na na na na 
na na na na na na na
Ice on my wrist yeah I like it like this
And I’m nice with the cream
If you know what I mean

Ice cream 
Ice cream 
Ice cream

Available on @ https://smarturl.it/IceCreamSingle

Official BLACKPINK Merchandise: http://smarturl.it/BLACKPINKShop/ 

More about BLACKPINK @
http://www.blackpinkofficial.com/
http://www.facebook.com/BLACKPINKOFFICIAL
http://www.youtube.com/BLACKPINKOFFICIAL
http://www.instagram.com/BLACKPINKOFFICIAL
https://twitter.com/BLACKPINK

#BLACKPINK #블랙핑크 #SelenaGomez #셀레나고메즈 #IceCream #NewSingle #MV #20200828_12amEST #20200828_1pmKST #OutNow #YG"
"tMhA_ek0Awk","2020-09-07T11:00:27Z","20.14.09","UCFH4dWqQQOYkyJZUGT4q5pg","Warped Perception","Driving with Gopro Inside My Intake Manifold (Toyota Supra Turbo)","24","https://i.ytimg.com/vi/tMhA_ek0Awk/default.jpg","5101012","75169","2378","0","5236","False","False","toyota supra|twin turbo|big turbo|toyota supra (automobile model)|gopro|gopro inside|Intake manifold|supra turbo sound|supra turbo noise|supra turbo flutter sound|supra turbo acceleration|mkiv supra|supra exhaust|2jz","I mount a GoPro camera inside of my intake manifold on my Toyota Supra Turbo and drive around like I normally do as well as a few Wide Open Throttle runs under boost to see what is going on inside the intake manifold of the Supra and your engine while you drive your car.

With all the air pressure differences, turbulence and Flow, I have always wondered what was going on inside the intake manifold when I was driving around especially on a turbocharged car where you have boost pressure, the sound of the engine running from inside the manifold was surreal.

I will be rigging and mounting cameras in all sorts of unusual places to give us a unique perspective and understanding of how things work, so don't forget to subscribe and hit that Bell!.


↓↓Social media Links↓↓

🐦 ► Twitter: https://twitter.com/WarpPerception
👍 ► Facebook: https://www.facebook.com/WarpPerception/
◙ ► Instagram: https://www.instagram.com/warped.perception
☢ ► IMDB: http://www.imdb.com/title/tt5548028/?

I sometimes post things early or post previews on FB and Instagram so if you like that sort of thing give them a visit. 

Please leave any opinions suggestions or comments Below and don't forget to check out our other videos and subscribe, Thank you.

Watch this in 4k when possible, it looks incredibly awesome !

Carbon 12
http://www.c12.tv

Produced By: Carbon 12

Directed By: Matt Mikka"
"cYS_iYMhwaw","2020-09-07T08:34:38Z","20.14.09","UCXm0bpjlfB0AF-ZdPhT0K1A","โหนกระแส (Hone-Krasae) Official"," สุดทางรัก  หนุ่ม ศรราม หย่า ติ๊ก บิ๊กบราเธอร์ - สุดทนถูกเจ้าหนี้ทวงเงินถึงบ้าน? l EP. 771l7 ก.ย. 63","25","https://i.ytimg.com/vi/cYS_iYMhwaw/default.jpg","4950404","51076","5744","0","46154","False","False","โหนกระแส|ดูออนไลน์|ย้อนหลัง|กระแส|ตีแผ่|หนุ่ม กรรชัย|โหนกระแสย้อนหลัง|หนุ่ม กรรชัย กำเนิดพลอย|เกาะกระแส|โหนกระแส ล่าสุดวันนี้|โหนกระแส ล่าสุด|โหนกระแสแต่เช้า|โหนกระแสแต่เช้าย้อนหลัง|ข่าวย้อนหลัง|โหนกระแส หนุ่มกรรชัยล่าสุด|หนุ่ม ศรราม ติ๊ก บิ๊กบราเธอร์|ติ๊ก บิ๊กบราเธอร์|หนุ่มศรรามหย่าติ๊ก|ศรราม เทพพิทักษ์|กนิษฐรินทร์ พัชรภักดีโชติ|ติ๊ก ศรราม โหนกระแส|ติ๊ก ศรราม","มาร่วมตีแผ่กระแสที่แรงที่สุดในสังคม กับรายการโหนกระแส 
สนับสนุนโดย วิตามินรวม Tomin เพื่อสุขภาพที่ดีของท่าน 
สนใจสั่งซื้อได้ที่ https://bit.ly/2YVmp75 
เวลาใหม่ จันทร์-ศุกร์ เวลา 12.20 น. ทางช่อง3HD กดเลข33
กดติดตาม Fan Page : https://www.facebook.com/HKS2017/"
"DRHh1Ol-EYk","2020-09-13T23:11:12Z","20.14.09","UCPq2ETz4aAGo2Z-8JisDPIA","ESL Counter-Strike","LIVE: FURIA vs. Team Liquid - ESL Pro League Season 12 - Group Stage - NA","20","https://i.ytimg.com/vi/DRHh1Ol-EYk/default.jpg","993949","13622","370","0","20","False","False","",""
"Fve5UfKO3U0","2020-09-12T16:00:04Z","20.14.09","UCSpFnDQr88xCZ80N-X7t0nQ","Corridor Crew","VFX Artists React to Bad & Great CGi 33","24","https://i.ytimg.com/vi/Fve5UfKO3U0/default.jpg","1206466","72458","479","0","4909","False","False","vfx artists|VFX|CGI|visual effects|shot breakdown|behind the scenes|movies|hollywood|Charlie's Angels|Cameron Diaz|Lucy Liu|GI Joe|The Rise of Cobra|2001|2001: A Space Odyssey|Hal 9000|Stargate|The World's End|Edgar Wright","Tacticool 3Loads is up on Corridor! WATCH HERE ► https://youtu.be/Ogr86FHeU6s

CONSIDER SUBSCRIBING ► http://bit.ly/Subscribe_Corridor_Crew
Watch Season 5 From Beginning ► https://bit.ly/Crew_Season_5

This Episode ►
Wren, Niko, and Clint break down some of the best (and worst) VFX in Hollywood!

FOLLOW ►
Instagram: http://bit.ly/_Corridor_Instagram
Sub-Reddit: http://bit.ly/_Corridor_Sub-Reddit

SUPPORT ► 
Join Our Website: https://bit.ly/Crew_Membership
Buy Merch: http://bit.ly/Corridor_Store

OUR GEAR ►
Most Used Equipment: http://bit.ly/CorridorCrew_Gear
Perfect Camera: https://bhpho.to/2FJpQmR
Puget Systems Computers: http://bit.ly/PC_Puget_Workstations

MUSIC ►
Epidemic: http://bit.ly/Corridor_Music click this link for a free month!
Check out Savants Music! ► http://bit.ly/Savant_Music"
"zxJDdRgs7Lw","2020-09-10T13:00:28Z","20.14.09","UCkWQ0gDrqOCarmUKmppD7GQ","JayzTwoCents","We finally have our hands on the NVIDIA RTX 3080!","28","https://i.ytimg.com/vi/zxJDdRgs7Lw/default.jpg","2221412","102598","4278","0","14084","False","False","30 series gpu|30 series video card|nvidia|rtx|nvidia rtx|rtx 3070|rtx 3080|rtx 3090|nvidia vs amd|amd vs nvidia|is the 3080 worth it|is the 3090 worth it|is the 3070 worth it|should I buy a 3070|should i buy a 3080|should I buy a 3090|is nvidia worth it|is amd worth it|how much is rtx 3070|how much is 3080|how much is 3090|how much does a 3070 cost|how much does a 3080 cost|how much does a 3090 cost|best video card 2020|best video card 2021|best","We got our hands on the NVIDIA RTX 3080 and it's BEAUTIFUL! Let's talk about what you need to know before buying one... 

**iFixit has over 60,000 tutorials and guides to help you repair your electronics FOR FREE! To see a complete list of guides and tools head to https://www.ifixit.com/jayztwocents
**And to get your very own iFixit Tools from Amazon head to - https://amzn.to/2Xu1xE2

○○○○○○ Items featured in this video available at Amazon ○○○○○○

► Amazon US - http://bit.ly/1meybOF
► Amazon UK - http://amzn.to/Zx813L
► Amazon Canada - http://amzn.to/1tl6vc6

Get your JayzTwoCents Merch Here! - https://crowdmade.com/collections/jayztwocents

••• Follow me on your favorite Social Media! •••
Facebook: http://www.facebook.com/jayztwocents
Twitter: http://www.twitter.com/jayztwocents
Instagram: http://instagram.com/jayztwocents#
SUBSCRIBE! http://bit.ly/sub2JayzTwoCents"
"BZ8up-E0SR0","2020-09-06T06:00:03Z","20.14.09","UCTQJ4_K6Y-CE3XttBXyvGbA","TV 2","Hvilken sjokolademelk er den beste?","24","https://i.ytimg.com/vi/BZ8up-E0SR0/default.jpg","47924","1115","26","0","101","False","False","tv2|tv 2 hjelper deg|test|cocio|mat og drikke|sjokolademelk|litago|q-meieriene|yt|fru timian|melk|drikke|2020|best i test","TV 2 hjelper deg har testet ti typer sjokolademelk, og noen av de sunneste variantene overrasker stort.
Se TV 2 hjelper deg på TV 2 torsdag klokken 20.00 eller når du vil på TV 2 Sumo: https://sumo.tv2.no/programmer/fakta/tv-2-hjelper-deg/

Ikke gå glipp av noe – abonner på TV 2s YouTube-kanal: https://goo.gl/eJKKfL"
"XI9kKiyIMf0","2020-09-11T15:00:07Z","20.14.09","UCHAahQqEGNM-Usc4FJTAVdw","123 GO! FOOD","WE TESTED VIRAL TikTok LIFE HACKS TO SEE IF THEY WORK || Crazy DIY Food Tricks by 123 GO! FOOD","22","https://i.ytimg.com/vi/XI9kKiyIMf0/default.jpg","2658166","27107","3197","0","1241","False","False","123|go|food","Did you think any of these TIK TOK cooking tricks were actually legit? 
Well, thanks to us, you didn’t have to make a mess in your kitchen. 

Which TIK TOK cooking hacks do you wish we tried in this video? Have you tried some at home yourself? Tell us about it and share this video with your pals!

Give these videos a watch if you haven’t already. And be sure to subscribe to our YouTube channel!

Music by Epidemic Sound: https://www.epidemicsound.com/
Stock materials: https://www.depositphotos.com https://www.shutterstock.com

This video is made for entertainment purposes. We do not make any warranties about the completeness, safety and reliability. Any action you take upon the information on this video is strictly at your own risk, and we will not be liable for any damages or losses. It is the viewer's responsibility to use judgment, care and precautions if one plans to replicate.

The following video might feature activity performed by our actors within controlled environment - please use judgment, care, and precaution if you plan to replicate."
"jLkLH_RQRuQ","2020-09-13T17:24:50Z","20.14.09","UCe0TLA0EsQbE-MjuHXevj2A","ATHLEAN-X™","How to Lose Fat (EAT CARBS!)","26","https://i.ytimg.com/vi/jLkLH_RQRuQ/default.jpg","278626","19058","486","0","2226","False","False","how to lose fat|lose fat|how to lose fat fast|diet to lose fat|workout to lose fat|fat loss diet|fat loss workout|workout for fat loss|diet for fat loss|how to lose belly fat|how to lose stomach fat|how to lose fat for men|how to lose fat for women|how to lose fat and gain muscle|how to lose fat without working out|athleanx|athlean x|jeff cavaliere|healthy carbs|low carb diet|lose weight eating carbs|how to eat carbs and still lose weight","If you want to learn how to lose fat then you are going to have to possibly re-learn how to eat carbs. Let’s face it, you have likely been told that eating carbohydrates is making you fat. While there may be some truth to the rumor, it is only because you have been eating them excess. That said, there are some built-in pitfalls that make including carbs in our diets something that we have to be mindful of, however I am going to show you what those are and how to work around them in this video.

The key to fat burning is that you need to be in a hypocaloric state. Due to the tendency we have of overeating carbs there is some logic to the fact that by eliminating them from our diets we will consume fewer calories overall. That said, the replacement of the carbs has to come from somewhere. In the case of keto diets it comes in the form of fats and proteins, mostly from dietary fats. 

The issue with this approach is that the macronutrient we are replacing them with is twice as calorie dense as the carbohydrates themselves. 

Not to mention, it is often the case that the method we use to lose fat and drop weight in the first place is the one we are going to have to continue to use if we want to see long term permanent changes. It is here that I find the keto diet approach difficult to sustain.

So, instead of looking to exclude carbohydrates from your meal plan you need to learn to coexist with them.

That doesn’t mean that there aren’t pitfalls that we need to be mindful of however. First there is no denying the fact that carbs taste better and create more cravings than say isolated proteins or fats. It is likely due to the fact that our brains are hard wired to seek out sugars and glucose to fuel its function. Beyond that however is the additional information that carbs are not nearly as satiating as fats or proteins.

So there are definite reasons for why many people are trying to reduce them or even eliminate them from their diets these days but again, I do not believe this sets you up best for long term success. Any diet plan that is deprivation based, while it may help you to lose fat in the short term is not going to be something you can stick with forever.

In general, there are three main categories; simple sugars, complex starches and fibers. Eating carbohydrates from the fibrous carb category will have the least pronounced negative impact on rapidly raising your blood sugar levels and resultant insulin spikes.

The additional fiber present in these foods not only blunts this effect but also makes them more “bulky” food options. Add in the healthy nutrient boost these foods provide with them with plenty of vitamins and minerals and it is easy to see why the majority of the carbs you eat when you are trying to lose fat should come from here.

The simple sugars are the nutrient low carbs that are worth eliminating from your diet if you want to be ripped and lean year round. It is here that many will reach for these types of foods when enjoying a cheat meal or day. It is here however that if you delve too often, you will find frustration in not being able to achieve the body fat levels you are after.

The starchy carbs are the ones we perceive as generally “healthier” but can still present hardship if we overeat them. These are the oats, grains, pastas, breads, etc. This is the area that I believe we need to learn how to include in our meal plans and put to work fueling our bodies and muscles if we want to see the best results not to mention long term sustainability. 

Beyond the identification of the types of carbs however we need to employ additional strategies to keep them helping us and not hurting our fat loss efforts. Learn the composition of the carbohydrates you are eating. Aim for carbs that provide no more than 10-20 percent of their total carbs from sugars. This information is easily available online. 

Watch the video I have on dividing your plate for success and entertain the idea of a low fat diet as an alternative to low carb eating for a more sustainable plan.

And lastly, don’t forget to train with weights to compliment your diet to lose fat. Building lean muscle is always going to help you in your efforts to lose body fat. The more lean muscle you have the more storage capacity you have for blood glucose in the form of muscle glycogen. 

The bottom line is, if you are looking for how to lose fat and want a step by step plan for getting it done permanently, you need a complete plan with workouts and meal plans laid out for you day by day. Those are all available for you at athleanx.com via the link below. 

If you are looking for more videos on jeff cavaliere’s meal plan or how to eat to burn fat fast, be sure to subscribe to our channel via the link below and remember to turn on your notifications so you never miss a new video when it’s published.

Build big, ripped triceps here - http://athleanx.com/x/my-workouts
Subscribe to this channel here - http://bit.ly/2b0coMW"
"N52NxrVjcqg","2020-09-11T20:36:24Z","20.14.09","UCNBbCOuAN1NZAuj0vPe_MkA","Car Throttle","Can You REALLY Daily Drive A 60-Year-Old Land Rover?","2","https://i.ytimg.com/vi/N52NxrVjcqg/default.jpg","499451","20416","298","0","1614","False","False","Car Throttle|CarThrottle|Alex Kersten|Land Rover|Range Rover|Off roading|4x4|Project car|vintage car|Cheap Car|Green laning|land rover defender|defender|ethan smale|jack joy","----- Follow The Guys -----
Alex: http://www.instagram.com/autoalex
Ethan: http://www.instagram.com/ethansmale
Jack: http://www.instagram.com/jackwjoy

This week, Alex, Ethan and Jack spend time with a 60-year-old Land Rover to find out if you can really live with a vehicular artefact!

SUBSCRIBE: http://bit.ly/CTSubscribe

CHECK OUT THE CAR THROTTLE SHOP!
https://shop.carthrottle.com/

----- Follow Car Throttle -----

Subscribe to Car Throttle: http://bit.ly/CTSubscribe

On our website: http://www.carthrottle.com
On Facebook: http://www.facebook.com/carthrottle
On Instagram: http://www.instagram.com/carthrottle
On Twitter: http://www.twitter.com/carthrottle

----- Music by -----

Epidemic Sound
http://www.epidemicsound.com"
"wVRd4Hyctp8","2020-09-12T20:39:01Z","20.14.09","UC14UlmYlSNiQCBe9Eookf_A","FC Barcelona","HIGHLIGHTS & REACTION | Barça 3-1 Nàstic","17","https://i.ytimg.com/vi/wVRd4Hyctp8/default.jpg","2864669","77175","2326","0","3851","False","False","FC Barcelona|برشلونة،|Fútbol|FUTBOL|soccer|FUTEBOL|Sepakbola|サッカー|كرة القدم|football|FCB|Barça|Sport|Club|Barcelona|CAMP NOU|ter stegen|semedo|pique|busquets|suarez|luis suarez|messi|goat|leo messi|messi skills|dembele|neto|lenglet|griezmann|antoine griezmann|yt:cc=on|ansu fati|riqui puig|koeman|trincao|coutinho|nastic|friendly|3-1|estadi johan cruyff|comeback|highlights|goals|new kit|transfers|new signing|Konrad de la Fuente|Araujo|Aleñá|Gimnàstic Tarragona","Enjoy the highlights of Barça's first pre-season victory, and a first win under new manager Ronald Koeman who spoke after the game with new signing Francisco Trincão.

SUBSCRIBE NOW:
▶ https://www.youtube.com/user/fcbarcelona 

⚽ BARÇATV+: http://barca.link/wT1w30qMyQO
🌐 Site: http://www.fcbarcelona.com
🔵 Facebook: http://www.facebook.com/fcbarcelona
🙌 Facebook Supporters: https://www.facebook.com/becomesupporter/fcbarcelona
📸 Instagram: http://www.instagram.com/fcbarcelona
🐦 Twitter: http://twitter.com/FCBarcelona
🎶 Tiktok: https://www.tiktok.com/@fcbarcelona 
📱 Viber: http://chats.viber.com/fcbarcelona

🛍 Get all official Barça apparel from FC Barcelona's online store: http://barca.link/j8QH30qQh4Y 
🔵🔴 #FCBarcelona"
"ICjbJGnce0s","2020-09-13T18:15:01Z","20.14.09","UC6IijBsVf2PlWo_uq6P9wQw","Gloom","I had the tiniest pizza party with my dog","24","https://i.ytimg.com/vi/ICjbJGnce0s/default.jpg","362719","29014","220","0","3233","False","False","tiny food|tiny food cooking|gloom|gloom tries|gloomgames|kassie|2020|tiny food cooking videos|tiny food cooking cake|tiny food cooking toys|diy|mini food|miniature|funny|mini food cooking|family friendly|dog reviews food with puppy|funny dog reaction|twinkie|chihuahua","My favourite form of edible food art as of late is tiny miniature food made with tiny utensils. Twinkie just got back from the vet and is improving every day, so I wanted to make him something to celebrate!
SUBSCRIBE HERE: https://www.youtube.com/channel/UC6IijBsVf2PlWo_uq6P9wQw?sub_confirmation=1
My INSTAGRAM: http://www.instagram.com/gloomykassie
My TWITTER: http://www.twitter.com/gloomykassie
My DISCORD SERVER (13 and up only): http://discord.gg/GLOOM

MERCH: http://gloom.store

WATCH MY HORRIBLE BITLIVES: https://www.youtube.com/watch?v=-RcgvL6bKZQ&list=PLwbhb6Gu7AnXcLWpGMezpMHtPc6MZIfwY

My TIK TOK is @gloomdog, here's a link: http://vm.tiktok.com/JTHb8L/

---------------------------------------------------------------------------
I'm Kassie, also known as Gloom! I'm a variety gamer who does gameplay commentary on indie games and some bigger titles too. I also do silly sketches, challenges, Q&As, and whatever makes you goof balls giggle.
---------------------------------------------------------------------------
I do my best to upload at a few times a week (unless my life is a mess)."
"2PWZSy8ZBtw","2020-09-13T10:57:45Z","20.14.09","UCV_59afytAhjWv9WWeixTFg","Kitokie pasikalbėjimai","„Kitokie pasikalbėjimai“ su Henry Match","24","https://i.ytimg.com/vi/2PWZSy8ZBtw/default.jpg","102788","2752","110","0","204","False","False","Kitokie pasikalbėjimai|Mantas Katleris|kitokie|laisvestv|pasikalbejimai|laikykites ten|Henry Match|Nicholas Kin|Comunija|Komunija|Komedija|Comedy","Pasinaudok „Surfshark“ VPN paslaugomis ir paspaudę šią nuorodą gaukite net 85 proc. nuolaidą: https://surfshark.deals/pasikalbejimai

„Maži žmonės daro didelius dalykus“. Taip turbūt labiausiai tiktų apibūdinti šį „Kitokių pasikalbėjimų“ svečią. Arba paprasčiau – egzistencializmo tyrinėtojas. Ponai ir ponios – vienintelis ir nepakartojamas Henry Match!

Muzikinės pertraukos metu pasirodo Henry Match alter ego „MC ENDray“.

Renginio vedėjas – Mantas Katleris.

Sekite „Kitokius pasikalbėjimus“ feisbuke: https://www.facebook.com/pg/KitokiePasikalbejimai/

Tapkite „Kitokių pasikalbėjimų“ rėmėjais: https://www.patreon.com/KitokiePasikalbejimai

„Kitokių pasikalbėjimų“ nealkoholinis alus – „Volfas Engelman“: http://volfasengelman.lt/
Pagrindiniai informaciniai rėmėjai – DELFI: https://www.delfi.lt/

Renginį šviečia COMBO
Laidą filmuoja SVLINE

#KitokiePasikalbejimai"
